{
  "$schema": "http://json-schema.org/draft-07/schema#",
  "type": "object",
  "title": "appFooter Configuration Schema",
  "description": "Auto-generated schema for appFooter configuration",
  "_generated": "2025-09-27T07:05:06.910Z",
  "_generator": "componentSchemaGenerator v1.0.0",
  "_version": "0.1.0",
  "properties": {
    "component": {
      "type": "object",
      "properties": {
        "name": {
          "type": "string",
          "minLength": 1
        },
        "displayName": {
          "type": "string",
          "minLength": 1
        },
        "type": {
          "type": "string",
          "enum": [
            "component",
            "service",
            "layout"
          ],
          "minLength": 1
        },
        "category": {
          "type": "string",
          "minLength": 1
        }
      },
      "additionalProperties": true
    },
    "ui": {
      "type": "object",
      "properties": {
        "layout": {
          "type": "object",
          "properties": {
            "height": {
              "type": "number",
              "minimum": 0
            },
            "position": {
              "type": "string",
              "minLength": 1
            },
            "background": {
              "type": "string",
              "pattern": "^#[0-9a-fA-F]{6}$",
              "description": "Hex color code",
              "minLength": 1
            },
            "color": {
              "type": "string",
              "pattern": "^#[0-9a-fA-F]{6}$",
              "description": "Hex color code",
              "minLength": 1
            },
            "fontSize": {
              "type": "string",
              "minLength": 1
            },
            "padding": {
              "type": "string",
              "minLength": 1
            }
          },
          "additionalProperties": true
        },
        "sections": {
          "type": "object",
          "properties": {
            "left": {
              "type": "object",
              "properties": {
                "copyright": {
                  "type": "object",
                  "properties": {
                    "enabled": {
                      "type": "boolean"
                    },
                    "text": {
                      "type": "string",
                      "minLength": 1
                    },
                    "fontSize": {
                      "type": "string",
                      "minLength": 1
                    }
                  },
                  "additionalProperties": true
                },
                "deviceInfo": {
                  "type": "object",
                  "properties": {
                    "enabled": {
                      "type": "boolean"
                    },
                    "showName": {
                      "type": "boolean"
                    },
                    "showModel": {
                      "type": "boolean"
                    },
                    "defaultName": {
                      "type": "string",
                      "minLength": 1
                    },
                    "defaultModel": {
                      "type": "string",
                      "minLength": 1
                    }
                  },
                  "additionalProperties": true
                },
                "systemInfo": {
                  "type": "object",
                  "properties": {
                    "enabled": {
                      "type": "boolean"
                    },
                    "showVersion": {
                      "type": "boolean"
                    },
                    "showBuildDate": {
                      "type": "boolean"
                    },
                    "showEnvironment": {
                      "type": "boolean"
                    }
                  },
                  "additionalProperties": true
                }
              },
              "additionalProperties": true
            },
            "center": {
              "type": "object",
              "properties": {
                "buildInfo": {
                  "type": "object",
                  "properties": {
                    "enabled": {
                      "type": "boolean"
                    },
                    "showBuildNumber": {
                      "type": "boolean"
                    },
                    "defaultVersion": {
                      "type": "string",
                      "minLength": 1
                    },
                    "defaultBuildNumber": {
                      "type": "string",
                      "minLength": 1
                    }
                  },
                  "additionalProperties": true
                },
                "currentTime": {
                  "type": "object",
                  "properties": {
                    "enabled": {
                      "type": "boolean"
                    },
                    "format": {
                      "type": "string",
                      "format": "uri",
                      "pattern": "^https?://",
                      "minLength": 1
                    },
                    "updateInterval": {
                      "type": "number",
                      "minimum": 0
                    }
                  },
                  "additionalProperties": true
                }
              },
              "additionalProperties": true
            },
            "right": {
              "type": "object",
              "properties": {
                "deviceStatus": {
                  "type": "object",
                  "properties": {
                    "enabled": {
                      "type": "boolean"
                    },
                    "defaultStatus": {
                      "type": "string",
                      "enum": [
                        "ONLINE",
                        "OFFLINE",
                        "CONNECTING",
                        "ERROR"
                      ],
                      "minLength": 1
                    },
                    "statusColors": {
                      "type": "object",
                      "properties": {
                        "ONLINE": {
                          "type": "string",
                          "pattern": "^#[0-9a-fA-F]{6}$",
                          "description": "Hex color code",
                          "minLength": 1
                        },
                        "OFFLINE": {
                          "type": "string",
                          "pattern": "^#[0-9a-fA-F]{6}$",
                          "description": "Hex color code",
                          "minLength": 1
                        },
                        "CONNECTING": {
                          "type": "string",
                          "pattern": "^#[0-9a-fA-F]{6}$",
                          "description": "Hex color code",
                          "minLength": 1
                        },
                        "ERROR": {
                          "type": "string",
                          "pattern": "^#[0-9a-fA-F]{6}$",
                          "description": "Hex color code",
                          "minLength": 1
                        }
                      },
                      "additionalProperties": true
                    }
                  },
                  "additionalProperties": true
                },
                "userInfo": {
                  "type": "object",
                  "properties": {
                    "enabled": {
                      "type": "boolean"
                    },
                    "showName": {
                      "type": "boolean"
                    },
                    "showRole": {
                      "type": "boolean"
                    },
                    "defaultName": {
                      "type": "string",
                      "minLength": 1
                    },
                    "defaultRole": {
                      "type": "string",
                      "enum": [
                        "OPERATOR",
                        "ADMIN",
                        "SUPERUSER",
                        "SERWISANT"
                      ],
                      "minLength": 1
                    }
                  },
                  "additionalProperties": true
                }
              },
              "additionalProperties": true
            }
          },
          "additionalProperties": true
        }
      },
      "additionalProperties": true
    },
    "data": {
      "type": "object",
      "properties": {
        "systemInfo": {
          "type": "object",
          "properties": {
            "version": {
              "type": "string",
              "minLength": 1
            },
            "buildDate": {
              "type": "string",
              "format": "date",
              "pattern": "^\\d{4}-\\d{2}-\\d{2}$",
              "minLength": 1
            },
            "environment": {
              "type": "string",
              "enum": [
                "development",
                "production",
                "staging"
              ],
              "minLength": 1
            }
          },
          "additionalProperties": true
        },
        "deviceInfo": {
          "type": "object",
          "properties": {
            "name": {
              "type": "string",
              "minLength": 1
            },
            "model": {
              "type": "string",
              "minLength": 1
            }
          },
          "additionalProperties": true
        },
        "buildInfo": {
          "type": "object",
          "properties": {
            "version": {
              "type": "string",
              "minLength": 1
            },
            "buildNumber": {
              "type": "string",
              "minLength": 1
            }
          },
          "additionalProperties": true
        },
        "currentUser": {
          "type": "object",
          "properties": {
            "name": {
              "type": "string",
              "minLength": 1
            },
            "role": {
              "type": "string",
              "enum": [
                "OPERATOR",
                "ADMIN",
                "SUPERUSER",
                "SERWISANT"
              ],
              "minLength": 1
            }
          },
          "additionalProperties": true
        },
        "deviceStatus": {
          "type": "string",
          "enum": [
            "ONLINE",
            "OFFLINE",
            "CONNECTING",
            "ERROR"
          ],
          "minLength": 1
        }
      },
      "additionalProperties": true
    },
    "responsive": {
      "type": "object",
      "properties": {
        "display79": {
          "type": "object",
          "properties": {
            "enabled": {
              "type": "boolean"
            },
            "maxWidth": {
              "type": "string",
              "minLength": 1
            },
            "maxHeight": {
              "type": "string",
              "minLength": 1
            },
            "optimizations": {
              "type": "array",
              "items": {
                "type": "string",
                "minLength": 1
              },
              "minItems": 0
            }
          },
          "additionalProperties": true
        }
      },
      "additionalProperties": true
    },
    "accessibility": {
      "type": "object",
      "properties": {
        "ariaLabels": {
          "type": "boolean"
        },
        "keyboardNavigation": {
          "type": "boolean"
        },
        "highContrast": {
          "type": "boolean"
        },
        "screenReader": {
          "type": "boolean"
        }
      },
      "additionalProperties": true
    },
    "performance": {
      "type": "object",
      "properties": {
        "updateInterval": {
          "type": "number",
          "minimum": 0
        },
        "enableCaching": {
          "type": "boolean"
        },
        "lazyLoading": {
          "type": "boolean"
        },
        "memoryManagement": {
          "type": "object",
          "properties": {
            "autoCleanup": {
              "type": "boolean"
            },
            "intervalCleanup": {
              "type": "boolean"
            },
            "cacheSize": {
              "type": "string",
              "minLength": 1
            }
          },
          "additionalProperties": true
        }
      },
      "additionalProperties": true
    },
    "security": {
      "type": "object",
      "properties": {
        "validation": {
          "type": "object",
          "properties": {
            "sanitizeUserInfo": {
              "type": "boolean"
            },
            "validateDeviceStatus": {
              "type": "boolean"
            },
            "allowedRoles": {
              "type": "array",
              "items": {
                "type": "string",
                "minLength": 1
              },
              "minItems": 0
            }
          },
          "additionalProperties": true
        },
        "protection": {
          "type": "object",
          "properties": {
            "xssProtection": {
              "type": "boolean"
            },
            "validateTimestamps": {
              "type": "boolean"
            },
            "sanitizeDisplayText": {
              "type": "boolean"
            }
          },
          "additionalProperties": true
        },
        "audit": {
          "type": "object",
          "properties": {
            "logUserActivity": {
              "type": "boolean"
            },
            "logStatusChanges": {
              "type": "boolean"
            },
            "retentionDays": {
              "type": "number",
              "minimum": 0
            }
          },
          "additionalProperties": true
        }
      },
      "additionalProperties": true
    }
  },
  "required": [
    "component",
    "ui",
    "data",
    "responsive",
    "accessibility",
    "performance",
    "security"
  ],
  "additionalProperties": false
}
